{
  "version": "1.0.0",
  "createdAt": "2026-09-05",
  "origin": {
    "conversationId": null,
    "title": "Men’s Health, Wellness, Hormones & Biohacking extension",
    "interpretation": "New 36-domain editorial mastery map responding to the request to extend the same curriculum and implementation approach beyond grooming.",
    "scope": "Infrastructure and research assignments only; no scientific claim approval."
  },
  "levels": [
    {
      "id": "F",
      "title": "Foundation",
      "order": 1
    },
    {
      "id": "M",
      "title": "Mastery",
      "order": 2
    },
    {
      "id": "A",
      "title": "Advanced",
      "order": 3
    },
    {
      "id": "R",
      "title": "Frontier",
      "order": 4
    }
  ],
  "layers": [
    {
      "id": "fundamentals",
      "title": "I — Human Biology & Evidence"
    },
    {
      "id": "daily-practice",
      "title": "II — Daily Health & Performance"
    },
    {
      "id": "clinical-literacy",
      "title": "III — Clinical Literacy & Care"
    },
    {
      "id": "interventions",
      "title": "IV — Nutrition, Products & Interventions"
    },
    {
      "id": "measurement-frontier",
      "title": "V — Measurement, Longevity & Frontier Research"
    },
    {
      "id": "consultation-governance",
      "title": "VI — Consultation, Quality & Governance"
    }
  ],
  "domains": [
    {
      "id": "H01",
      "order": 1,
      "title": "Human Biology, Physiology & the Male Lifespan",
      "primaryLayer": "fundamentals",
      "secondaryLayers": [],
      "aliases": [
        "human physiology",
        "male biology",
        "anatomy",
        "homeostasis"
      ],
      "outcome": "Explain interacting body systems and variation across men's lives without reducing health to testosterone.",
      "moduleIds": [
        "H01-F",
        "H01-M",
        "H01-A",
        "H01-R"
      ],
      "sourceSeedIds": [
        "health-seed-niddk",
        "health-seed-nia"
      ],
      "coverageGaps": [
        "Acquire topic-specific authoritative sources and qualified reviews; no scientific evidence ingested."
      ],
      "groomingDomainIds": [
        "D01",
        "D06"
      ]
    },
    {
      "id": "H02",
      "order": 2,
      "title": "Evidence, Statistics & Health Information Literacy",
      "primaryLayer": "fundamentals",
      "secondaryLayers": [],
      "aliases": [
        "health evidence",
        "clinical evidence",
        "study design",
        "health misinformation"
      ],
      "outcome": "Judge a specific health claim by methods, applicability and meaningful outcomes.",
      "moduleIds": [
        "H02-F",
        "H02-M",
        "H02-A",
        "H02-R"
      ],
      "sourceSeedIds": [
        "health-seed-uspstf"
      ],
      "coverageGaps": [
        "Acquire topic-specific authoritative sources and qualified reviews; no scientific evidence ingested."
      ],
      "groomingDomainIds": [
        "D18"
      ]
    },
    {
      "id": "H03",
      "order": 3,
      "title": "Preventive Care, Primary Care & Screening",
      "primaryLayer": "clinical-literacy",
      "secondaryLayers": [],
      "aliases": [
        "preventive care",
        "screening",
        "primary care",
        "checkup",
        "vaccines"
      ],
      "outcome": "Help men prepare for prevention discussions using age, risk, history and current jurisdiction-specific guidance.",
      "moduleIds": [
        "H03-F",
        "H03-M",
        "H03-A",
        "H03-R"
      ],
      "sourceSeedIds": [
        "health-seed-uspstf",
        "health-seed-nci"
      ],
      "coverageGaps": [
        "Acquire topic-specific authoritative sources and qualified reviews; no scientific evidence ingested."
      ],
      "groomingDomainIds": [
        "D18"
      ]
    },
    {
      "id": "H04",
      "order": 4,
      "title": "Nutrition, Food Literacy & Dietary Patterns",
      "primaryLayer": "daily-practice",
      "secondaryLayers": [],
      "aliases": [
        "nutrition",
        "diet",
        "protein",
        "fiber",
        "food",
        "nutrients"
      ],
      "outcome": "Build food literacy around adequacy, preferences, affordability and sustainable eating.",
      "moduleIds": [
        "H04-F",
        "H04-M",
        "H04-A",
        "H04-R"
      ],
      "sourceSeedIds": [
        "health-seed-niddk",
        "health-seed-ods"
      ],
      "coverageGaps": [
        "Acquire topic-specific authoritative sources and qualified reviews; no scientific evidence ingested."
      ],
      "groomingDomainIds": []
    },
    {
      "id": "H05",
      "order": 5,
      "title": "Body Composition, Weight & Metabolic Health",
      "primaryLayer": "clinical-literacy",
      "secondaryLayers": [],
      "aliases": [
        "body composition",
        "weight management",
        "obesity",
        "body fat",
        "metabolic health"
      ],
      "outcome": "Explain weight-related measurements and treatment categories without stigma or individualized prescribing.",
      "moduleIds": [
        "H05-F",
        "H05-M",
        "H05-A",
        "H05-R"
      ],
      "sourceSeedIds": [
        "health-seed-niddk"
      ],
      "coverageGaps": [
        "Acquire topic-specific authoritative sources and qualified reviews; no scientific evidence ingested."
      ],
      "groomingDomainIds": []
    },
    {
      "id": "H06",
      "order": 6,
      "title": "Glucose, Insulin & Diabetes Literacy",
      "primaryLayer": "clinical-literacy",
      "secondaryLayers": [],
      "aliases": [
        "glucose",
        "insulin",
        "diabetes",
        "hba1c",
        "blood sugar",
        "cgm"
      ],
      "outcome": "Explain glucose physiology and measurement limits while reserving diagnosis and treatment decisions for clinicians.",
      "moduleIds": [
        "H06-F",
        "H06-M",
        "H06-A",
        "H06-R"
      ],
      "sourceSeedIds": [
        "health-seed-niddk"
      ],
      "coverageGaps": [
        "Acquire topic-specific authoritative sources and qualified reviews; no scientific evidence ingested."
      ],
      "groomingDomainIds": []
    },
    {
      "id": "H07",
      "order": 7,
      "title": "Cardiovascular, Vascular & Blood Health",
      "primaryLayer": "clinical-literacy",
      "secondaryLayers": [],
      "aliases": [
        "heart health",
        "cardiovascular",
        "blood pressure",
        "cholesterol",
        "lipids",
        "vascular"
      ],
      "outcome": "Explain cardiovascular risk, common measurements and clinical care navigation.",
      "moduleIds": [
        "H07-F",
        "H07-M",
        "H07-A",
        "H07-R"
      ],
      "sourceSeedIds": [
        "health-seed-uspstf",
        "health-seed-nhlbi"
      ],
      "coverageGaps": [
        "Acquire topic-specific authoritative sources and qualified reviews; no scientific evidence ingested."
      ],
      "groomingDomainIds": []
    },
    {
      "id": "H08",
      "order": 8,
      "title": "Strength, Muscle & Resistance Training",
      "primaryLayer": "daily-practice",
      "secondaryLayers": [],
      "aliases": [
        "strength training",
        "resistance training",
        "muscle",
        "hypertrophy",
        "lifting"
      ],
      "outcome": "Explain progressive training principles with adaptation, recovery and individual constraints.",
      "moduleIds": [
        "H08-F",
        "H08-M",
        "H08-A",
        "H08-R"
      ],
      "sourceSeedIds": [
        "health-seed-ods-performance",
        "health-seed-activity"
      ],
      "coverageGaps": [
        "Acquire topic-specific authoritative sources and qualified reviews; no scientific evidence ingested."
      ],
      "groomingDomainIds": [
        "D14"
      ]
    },
    {
      "id": "H09",
      "order": 9,
      "title": "Aerobic Fitness, Endurance & Conditioning",
      "primaryLayer": "daily-practice",
      "secondaryLayers": [],
      "aliases": [
        "cardio",
        "aerobic",
        "vo2 max",
        "endurance",
        "zone 2",
        "conditioning"
      ],
      "outcome": "Explain conditioning principles and measurement limits across beginner and athletic goals.",
      "moduleIds": [
        "H09-F",
        "H09-M",
        "H09-A",
        "H09-R"
      ],
      "sourceSeedIds": [
        "health-seed-ods-performance",
        "health-seed-activity"
      ],
      "coverageGaps": [
        "Acquire topic-specific authoritative sources and qualified reviews; no scientific evidence ingested."
      ],
      "groomingDomainIds": []
    },
    {
      "id": "H10",
      "order": 10,
      "title": "Mobility, Musculoskeletal Health & Injury Literacy",
      "primaryLayer": "daily-practice",
      "secondaryLayers": [],
      "aliases": [
        "mobility",
        "joint health",
        "injury",
        "tendon",
        "bone",
        "back pain"
      ],
      "outcome": "Support movement literacy and rehabilitation conversations without diagnosing injuries.",
      "moduleIds": [
        "H10-F",
        "H10-M",
        "H10-A",
        "H10-R"
      ],
      "sourceSeedIds": [
        "health-seed-nia",
        "health-seed-activity"
      ],
      "coverageGaps": [
        "Acquire topic-specific authoritative sources and qualified reviews; no scientific evidence ingested."
      ],
      "groomingDomainIds": []
    },
    {
      "id": "H11",
      "order": 11,
      "title": "Sleep, Circadian Rhythm & Fatigue",
      "primaryLayer": "daily-practice",
      "secondaryLayers": [],
      "aliases": [
        "sleep",
        "circadian",
        "insomnia",
        "fatigue",
        "sleep apnea"
      ],
      "outcome": "Explain sleep fundamentals and persistent-fatigue assessment without substituting a supplement for diagnosis.",
      "moduleIds": [
        "H11-F",
        "H11-M",
        "H11-A",
        "H11-R"
      ],
      "sourceSeedIds": [